{
  "generated_at": "2026-05-15T00:00:00+00:00",
  "scope": "unique_fiche_main_pdf_formula_sections",
  "source_index": "index_fiches_uniques.csv",
  "summary": {
    "total_unique_fiches": 217,
    "pdf_checked": 217,
    "ok": 216,
    "known_missing_source": 1,
    "needs_review": 0,
    "failed": 0,
    "section5_found": 216,
    "section5_missing": 1,
    "total_source_values": 4071,
    "total_json_values": 4071,
    "total_missing_values": 0
  },
  "items": [
    {
      "code": "AGRI-EQ-101",
      "sector": "Agriculture_AGRI",
      "source_file": "Agriculture_AGRI/AGRI-EQ-101 vA14-1.pdf",
      "source_url": "https://www.ecologie.gouv.fr/sites/default/files/documents/AGRI-EQ-101%20vA14-1.pdf",
      "page_count": 1,
      "section5_found": true,
      "section5_page_start": 1,
      "section5_page_end": 1,
      "formula_status": "extracted",
      "formula_text": "Montant en kWh cumac × S",
      "source_value_count": 2,
      "json_value_count": 2,
      "missing_value_count": 0,
      "known_missing_reason": null,
      "status": "ok",
      "warnings": [],
      "error": null
    },
    {
      "code": "AGRI-EQ-102",
      "sector": "Agriculture_AGRI",
      "source_file": "Agriculture_AGRI/AGRI-EQ-102 vA65-2 à compter du 01-04-2025_0.pdf",
      "source_url": "https://www.ecologie.gouv.fr/sites/default/files/documents/AGRI-EQ-102%20vA65-2%20%C3%A0%20compter%20du%2001-04-2025_0.pdf",
      "page_count": 1,
      "section5_found": true,
      "section5_page_start": 1,
      "section5_page_end": 1,
      "formula_status": "extracted",
      "formula_text": "Montant en kWh cumac × S",
      "source_value_count": 2,
      "json_value_count": 2,
      "missing_value_count": 0,
      "known_missing_reason": null,
      "status": "ok",
      "warnings": [],
      "error": null
    },
    {
      "code": "AGRI-EQ-104",
      "sector": "Agriculture_AGRI",
      "source_file": "Agriculture_AGRI/AGRI-EQ-104 vA62-2 à compter du 01-01-2025_0.pdf",
      "source_url": "https://www.ecologie.gouv.fr/sites/default/files/documents/AGRI-EQ-104%20vA62-2%20%C3%A0%20compter%20du%2001-01-2025_0.pdf",
      "page_count": 1,
      "section5_found": true,
      "section5_page_start": 1,
      "section5_page_end": 1,
      "formula_status": "extracted",
      "formula_text": "Montant en kWh cumac × S",
      "source_value_count": 2,
      "json_value_count": 2,
      "missing_value_count": 0,
      "known_missing_reason": null,
      "status": "ok",
      "warnings": [],
      "error": null
    },
    {
      "code": "AGRI-EQ-105",
      "sector": "Agriculture_AGRI",
      "source_file": "Agriculture_AGRI/AGRI-EQ-105 vA28-1 à compter du 19-12-2018.pdf",
      "source_url": "https://www.ecologie.gouv.fr/sites/default/files/documents/AGRI-EQ-105%20vA28-1%20%C3%A0%20compter%20du%2019-12-2018.pdf",
      "page_count": 1,
      "section5_found": true,
      "section5_page_start": 1,
      "section5_page_end": 1,
      "formula_status": "extracted",
      "formula_text": "Montant en kWh cumac par véhicule × N",
      "source_value_count": 1,
      "json_value_count": 1,
      "missing_value_count": 0,
      "known_missing_reason": null,
      "status": "ok",
      "warnings": [],
      "error": null
    },
    {
      "code": "AGRI-EQ-106",
      "sector": "Agriculture_AGRI",
      "source_file": "Agriculture_AGRI/AGRI-EQ-106 vA32-1.pdf",
      "source_url": "https://www.ecologie.gouv.fr/sites/default/files/documents/AGRI-EQ-106%20vA32-1.pdf",
      "page_count": 3,
      "section5_found": true,
      "section5_page_start": 2,
      "section5_page_end": 3,
      "formula_status": "extracted",
      "formula_text": "Montant en kWh cumac × V",
      "source_value_count": 3,
      "json_value_count": 3,
      "missing_value_count": 0,
      "known_missing_reason": null,
      "status": "ok",
      "warnings": [],
      "error": null
    },
    {
      "code": "AGRI-EQ-107",
      "sector": "Agriculture_AGRI",
      "source_file": "Agriculture_AGRI/AGRI-EQ-107 vA38-1 à compter du 31-07-2021.pdf",
      "source_url": "https://www.ecologie.gouv.fr/sites/default/files/documents/AGRI-EQ-107%20vA38-1%20%C3%A0%20compter%20du%2031-07-2021.pdf",
      "page_count": 2,
      "section5_found": true,
      "section5_page_start": 2,
      "section5_page_end": 2,
      "formula_status": "extracted",
      "formula_text": "Montant en kWh cumac × S",
      "source_value_count": 2,
      "json_value_count": 2,
      "missing_value_count": 0,
      "known_missing_reason": null,
      "status": "ok",
      "warnings": [],
      "error": null
    },
    {
      "code": "AGRI-EQ-108",
      "sector": "Agriculture_AGRI",
      "source_file": "Agriculture_AGRI/AGRI-EQ-108 vA58-2 à compter du 01-02-2024_0.pdf",
      "source_url": "https://www.ecologie.gouv.fr/sites/default/files/documents/AGRI-EQ-108%20vA58-2%20%C3%A0%20compter%20du%2001-02-2024_0.pdf",
      "page_count": 2,
      "section5_found": true,
      "section5_page_start": 2,
      "section5_page_end": 2,
      "formula_status": "extracted",
      "formula_text": "Montant de kWh cumac par m² × S",
      "source_value_count": 1,
      "json_value_count": 1,
      "missing_value_count": 0,
      "known_missing_reason": null,
      "status": "ok",
      "warnings": [],
      "error": null
    },
    {
      "code": "AGRI-EQ-109",
      "sector": "Agriculture_AGRI",
      "source_file": "Agriculture_AGRI/AGRI-EQ-109 vA58-2 à compter du 01-02-2024_0.pdf",
      "source_url": "https://www.ecologie.gouv.fr/sites/default/files/documents/AGRI-EQ-109%20vA58-2%20%C3%A0%20compter%20du%2001-02-2024_0.pdf",
      "page_count": 2,
      "section5_found": true,
      "section5_page_start": 2,
      "section5_page_end": 2,
      "formula_status": "extracted",
      "formula_text": "Montant de kWh cumac par m² × S",
      "source_value_count": 4,
      "json_value_count": 4,
      "missing_value_count": 0,
      "known_missing_reason": null,
      "status": "ok",
      "warnings": [],
      "error": null
    },
    {
      "code": "AGRI-EQ-110",
      "sector": "Agriculture_AGRI",
      "source_file": "Agriculture_AGRI/AGRI-EQ-110 vA38-1 à compter du 31-07-2021.pdf",
      "source_url": "https://www.ecologie.gouv.fr/sites/default/files/documents/AGRI-EQ-110%20vA38-1%20%C3%A0%20compter%20du%2031-07-2021.pdf",
      "page_count": 2,
      "section5_found": true,
      "section5_page_start": 2,
      "section5_page_end": 2,
      "formula_status": "extracted",
      "formula_text": "Montant en kWh cumac par kW thermique installé Puissance thermique × P",
      "source_value_count": 18,
      "json_value_count": 18,
      "missing_value_count": 0,
      "known_missing_reason": null,
      "status": "ok",
      "warnings": [],
      "error": null
    },
    {
      "code": "AGRI-EQ-111",
      "sector": "Agriculture_AGRI",
      "source_file": "Agriculture_AGRI/AGRI-EQ-111 vA62-1 à compter du 31-08-2024_0.pdf",
      "source_url": "https://www.ecologie.gouv.fr/sites/default/files/documents/AGRI-EQ-111%20vA62-1%20%C3%A0%20compter%20du%2031-08-2024_0.pdf",
      "page_count": 1,
      "section5_found": true,
      "section5_page_start": 1,
      "section5_page_end": 1,
      "formula_status": "extracted",
      "formula_text": "Montant en kWh cumac par m² de serre équipée Surface de la serre × S",
      "source_value_count": 2,
      "json_value_count": 2,
      "missing_value_count": 0,
      "known_missing_reason": null,
      "status": "ok",
      "warnings": [],
      "error": null
    },
    {
      "code": "AGRI-EQ-112",
      "sector": "Agriculture_AGRI",
      "source_file": "Agriculture_AGRI/AGRI-EQ-112 vA73-3 à compter du 01-09-2025_0.pdf",
      "source_url": "https://www.ecologie.gouv.fr/sites/default/files/documents/AGRI-EQ-112%20vA73-3%20%C3%A0%20compter%20du%2001-09-2025_0.pdf",
      "page_count": 1,
      "section5_found": true,
      "section5_page_start": 1,
      "section5_page_end": 1,
      "formula_status": "extracted",
      "formula_text": "Montant en kWh cumac × S",
      "source_value_count": 2,
      "json_value_count": 2,
      "missing_value_count": 0,
      "known_missing_reason": null,
      "status": "ok",
      "warnings": [],
      "error": null
    },
    {
      "code": "AGRI-SE-101",
      "sector": "Agriculture_AGRI",
      "source_file": "Agriculture_AGRI/AGRI-SE-101 vA40-2 à compter du 01-04-2022_0.pdf",
      "source_url": "https://www.ecologie.gouv.fr/sites/default/files/documents/AGRI-SE-101%20vA40-2%20%C3%A0%20compter%20du%2001-04-2022_0.pdf",
      "page_count": 1,
      "section5_found": true,
      "section5_page_start": 1,
      "section5_page_end": 1,
      "formula_status": "extracted",
      "formula_text": "Montant en kWh cumac",
      "source_value_count": 8,
      "json_value_count": 8,
      "missing_value_count": 0,
      "known_missing_reason": null,
      "status": "ok",
      "warnings": [],
      "error": null
    },
    {
      "code": "AGRI-TH-101",
      "sector": "Agriculture_AGRI",
      "source_file": "Agriculture_AGRI/AGRI-TH-101 vA62-2 à compter du 01-01-2025.pdf",
      "source_url": "https://www.ecologie.gouv.fr/sites/default/files/documents/AGRI-TH-101%20vA62-2%20%C3%A0%20compter%20du%2001-01-2025.pdf",
      "page_count": 1,
      "section5_found": true,
      "section5_page_start": 1,
      "section5_page_end": 1,
      "formula_status": "extracted",
      "formula_text": "Montant unitaire en kWh cumac par m² Surface de serres chauffée × S",
      "source_value_count": 1,
      "json_value_count": 1,
      "missing_value_count": 0,
      "known_missing_reason": null,
      "status": "ok",
      "warnings": [],
      "error": null
    },
    {
      "code": "AGRI-TH-102",
      "sector": "Agriculture_AGRI",
      "source_file": "Agriculture_AGRI/AGRI-TH-102 vA14-1.pdf",
      "source_url": "https://www.ecologie.gouv.fr/sites/default/files/documents/AGRI-TH-102%20vA14-1.pdf",
      "page_count": 1,
      "section5_found": true,